{
  "id": "run-demo-0001:SENSOR_003:1792483210000",
  "source": "simulateur/run-demo-0001",
  "type": "novaria.iot.measurement.v1",
  "time": "2026-10-20T08:00:10Z",
  "subject": "INT_01",
  "schema_version": "1.0",
  "correlation_id": "corr-1792483210000",
  "domain": "iot",
  "data": {
    "sensor_id": "SENSOR_003",
    "road_segment_id": "ROAD_003",
    "intersection_id": "INT_01",
    "interval_s": 10,
    "vehicle_count": 3,
    "average_speed_kmh": null,
    "occupancy_rate": 0.18,
    "quality": {
      "status": "PARTIAL",
      "flags": [
        "MISSING_SPEED"
      ]
    },
    "provenance": {
      "source_type": "SIMULATED",
      "run_id": "run-demo-0001",
      "scenario_id": "heure-de-pointe",
      "seed": 42
    }
  }
}
